{
  "$schema": "./11-SYSTEM/schemas/update-manifest.schema.json",
  "schemaVersion": "1.0.0",
  "frameworkVersion": "1.0.0",
  "source": "https://github.com/aitooltip/company-brain",
  "updateChannel": "stable-releases",
  "releaseTag": "v1.0.0",
  "ownershipResolution": [
    "An exact path in frameworkOwned.files is AI Tooltip framework-owned.",
    "Otherwise, an existing path in companyOwned.paths or under companyOwned.prefixes is user/company-owned.",
    "Every existing unlisted path is user/company-owned by default.",
    "A missing path newly declared framework-owned by a stable release may be added only after explicit update approval and only when no local path exists there.",
    "No update is permission to overwrite canonical company knowledge or a locally customized framework file."
  ],
  "frameworkOwned": {
    "description": "AI Tooltip operating rules, adapters, public documentation, department instructions, Creative framework workflows and inactive templates, schemas, migrations, validators, update logic, and official general skills or their pre-release markers.",
    "files": [
      ".company-brain/current-user.example.md",
      ".gitignore",
      "00-INBOX/README.md",
      "00-MIGRATE-OLD-SETUP/README.md",
      "02-DEPARTMENTS/Analytics/AGENTS.md",
      "02-DEPARTMENTS/Analytics/README.md",
      "02-DEPARTMENTS/Business/AGENTS.md",
      "02-DEPARTMENTS/Business/README.md",
      "02-DEPARTMENTS/Creative/AGENTS.md",
      "02-DEPARTMENTS/Creative/README.md",
      "02-DEPARTMENTS/Creative/skills/README.md",
      "02-DEPARTMENTS/Creative/skills/brand-specific/README.md",
      "02-DEPARTMENTS/Creative/skills/brand-specific/core-brand/SKILL.template.md",
      "02-DEPARTMENTS/Creative/skills/brand-specific/motion/SKILL.template.md",
      "02-DEPARTMENTS/Creative/skills/brand-specific/presentation/SKILL.template.md",
      "02-DEPARTMENTS/Creative/skills/brand-specific/print-editorial/SKILL.template.md",
      "02-DEPARTMENTS/Creative/skills/brand-specific/social-media/SKILL.template.md",
      "02-DEPARTMENTS/Creative/skills/brand-specific/web-design/SKILL.template.md",
      "02-DEPARTMENTS/Creative/skills/general/README.md",
      "02-DEPARTMENTS/Creative/skills/general/no-slop/SKILL.md",
      "02-DEPARTMENTS/Creative/skills/general/ui-ux/SKILL.md",
      "02-DEPARTMENTS/Creative/skills/general/vector-design/SKILL.md",
      "02-DEPARTMENTS/Creative/workflows/README.md",
      "02-DEPARTMENTS/Creative/workflows/build-brand-kit.md",
      "02-DEPARTMENTS/Creative/workflows/build-brand-skill.md",
      "02-DEPARTMENTS/Creative/workflows/build-core-brand.md",
      "02-DEPARTMENTS/Creative/workflows/build-design-system.md",
      "02-DEPARTMENTS/Creative/workflows/refine-brand-skill.md",
      "02-DEPARTMENTS/Product-and-Development/AGENTS.md",
      "02-DEPARTMENTS/Product-and-Development/README.md",
      "02-DEPARTMENTS/README.md",
      "11-SYSTEM/AGENTS.md",
      "11-SYSTEM/OPERATING-SYSTEM.md",
      "11-SYSTEM/README.md",
      "11-SYSTEM/RELEASING.md",
      "11-SYSTEM/migrations/README.md",
      "11-SYSTEM/migrations/ai-design-skills.md",
      "11-SYSTEM/migrations/codex-design-studio.md",
      "11-SYSTEM/reviews/2026-09-08-public-v1-review.md",
      "11-SYSTEM/reviews/README.md",
      "11-SYSTEM/schemas/README.md",
      "11-SYSTEM/schemas/brain-config.schema.json",
      "11-SYSTEM/schemas/decision.schema.json",
      "11-SYSTEM/schemas/goal.schema.json",
      "11-SYSTEM/schemas/product.schema.json",
      "11-SYSTEM/schemas/project.schema.json",
      "11-SYSTEM/schemas/research.schema.json",
      "11-SYSTEM/schemas/team-member.schema.json",
      "11-SYSTEM/schemas/update-manifest.schema.json",
      "11-SYSTEM/scripts/README.md",
      "11-SYSTEM/scripts/apply_approved_update.py",
      "11-SYSTEM/scripts/check_for_updates.py",
      "11-SYSTEM/scripts/update_lib.py",
      "11-SYSTEM/scripts/validate_brain.py",
      "11-SYSTEM/templates/README.md",
      "11-SYSTEM/templates/activity-entry.md",
      "11-SYSTEM/templates/decision.md",
      "11-SYSTEM/templates/goal.md",
      "11-SYSTEM/templates/product.md",
      "11-SYSTEM/templates/project.md",
      "11-SYSTEM/templates/research.md",
      "11-SYSTEM/templates/team-member.md",
      "11-SYSTEM/workflows/README.md",
      "11-SYSTEM/workflows/apply-approved-update.md",
      "11-SYSTEM/workflows/check-for-ai-tooltip-updates.md",
      "11-SYSTEM/workflows/initialize-company-brain.md",
      "11-SYSTEM/workflows/log-meaningful-activity.md",
      "11-SYSTEM/workflows/migrate-previous-ai-tooltip-setup.md",
      "11-SYSTEM/workflows/onboard-team-member.md",
      "11-SYSTEM/workflows/process-inbox.md",
      "11-SYSTEM/workflows/record-approved-decision.md",
      "11-SYSTEM/workflows/start-project.md",
      "AGENTS.md",
      "CLAUDE.md",
      "COLLABORATION.md",
      "LICENSE.md",
      "PRIVACY.md",
      "README.md",
      "START-HERE.md",
      "brain.config.json",
      "update-manifest.json"
    ],
    "sensitiveReviewFiles": [
      "LICENSE.md",
      "PRIVACY.md",
      "11-SYSTEM/OPERATING-SYSTEM.md"
    ]
  },
  "companyOwned": {
    "description": "User/company knowledge and work. These paths are never automatic overwrite or deletion targets.",
    "paths": [
      ".company-brain/current-user.md",
      "01-COMPANY/COMPANY.md",
      "01-COMPANY/audience.md",
      "01-COMPANY/strategy.md",
      "01-COMPANY/decisions/INDEX.md",
      "02-DEPARTMENTS/Analytics/DEPARTMENT.md",
      "02-DEPARTMENTS/Business/DEPARTMENT.md",
      "02-DEPARTMENTS/Creative/DEPARTMENT.md",
      "02-DEPARTMENTS/Product-and-Development/DEPARTMENT.md",
      "03-BRAND/BRAND.md",
      "03-BRAND/positioning.md"
    ],
    "prefixes": [
      ".company-brain/",
      "00-INBOX/",
      "00-MIGRATE-OLD-SETUP/",
      "01-COMPANY/",
      "02-DEPARTMENTS/",
      "03-BRAND/",
      "04-PRODUCTS/",
      "05-PROJECTS/",
      "06-RESEARCH/",
      "07-CONTENT/",
      "08-REFERENCES/",
      "09-ASSETS/",
      "10-OUTPUTS/"
    ]
  },
  "updatePolicy": {
    "channel": "stable-releases",
    "semanticReleaseTags": true,
    "checkIsReadOnly": true,
    "gitRequiredForCheck": false,
    "automaticInstall": false,
    "automaticOverwrite": false,
    "automaticDelete": false,
    "explicitApprovalRequiredToApply": true,
    "companyKnowledgeConflictRequiresExplicitApproval": true,
    "localFrameworkCustomizationRequiresReview": true,
    "unlistedPathsDefaultToCompanyOwned": true
  }
}
